[
  {
    "name": "Hampton Roads DevFest 2027",
    "url": "https://hrdevfest.org/",
    "description": "Save the date for Hampton Roads DevFest 2027. Details are coming soon.",
    "date": "2027-04-23",
    "location": "Zeiders",
    "tags": ["Web", "Cloud", "Mobile", "Community"],
    "coverImage": "/images/devfest.png"
  },
  {
    "name": "BSides Hampton Roads 2026",
    "url": "https://bsideshamptonroads.org/",
    "description": "A community-driven information security conference at ODU's Webb University Center — talks, hands-on villages, and networking for the Hampton Roads infosec community.",
    "date": "2026-10-09",
    "endDate": "2026-10-10",
    "location": "Norfolk, VA",
    "tags": ["Security", "Infosec", "Community"],
    "coverImage": "/images/bsides.png"
  },
  {
    "name": "Hampton Roads DevFest 2026",
    "url": "https://hrdevfest.org/",
    "description": "A unique gathering spotlighting local speakers and showcasing our community's diverse talent. Organized by RevolutionVA, a 501(c)(3) non-profit dedicated to advancing software development education throughout Virginia. Ideal for developers, industry veterans, students, and tech enthusiasts looking to network, learn, and celebrate Hampton Roads' tech achievements.",
    "date": "2026-02-27",
    "endDate": "2026-02-27",
    "location": "Virginia Beach, VA",
    "tags": ["Web", "Cloud", "Mobile", "Community"],
    "coverImage": "/images/devfest.png"
  },
  {
    "name": "Hampton Roads DevFest 2024",
    "url": "https://hrdevfest.org/",
    "description": "A unique gathering spotlighting local speakers and showcasing our community's diverse talent. Organized by RevolutionVA, a 501(c)(3) non-profit dedicated to advancing software development education throughout Virginia. Ideal for developers, industry veterans, students, and tech enthusiasts looking to network, learn, and celebrate Hampton Roads' tech achievements.",
    "date": "2024-05-31",
    "endDate": "2024-05-31",
    "location": "Norfolk, VA",
    "tags": ["Web", "Cloud", "Mobile", "Community"],
    "coverImage": "/images/devfest.png"
  },
  {
    "name": "Hampton Roads DevFest 2018",
    "url": "https://hrdevfest.org/",
    "description": "A unique gathering spotlighting local speakers and showcasing our community's diverse talent. Organized by RevolutionVA, a 501(c)(3) non-profit dedicated to advancing software development education throughout Virginia. Ideal for developers, industry veterans, students, and tech enthusiasts looking to network, learn, and celebrate Hampton Roads' tech achievements.",
    "date": "2018-11-16",
    "endDate": "2018-11-16",
    "location": "Norfolk, VA",
    "tags": ["Web", "Cloud", "Mobile", "Community"],
    "coverImage": "/images/devfest.png"
  },
  {
    "name": "Hampton Roads DevFest 2017",
    "url": "https://hrdevfest.org/",
    "description": "A unique gathering spotlighting local speakers and showcasing our community's diverse talent. Organized by RevolutionVA, a 501(c)(3) non-profit dedicated to advancing software development education throughout Virginia. Ideal for developers, industry veterans, students, and tech enthusiasts looking to network, learn, and celebrate Hampton Roads' tech achievements.",
    "date": "2017-11-10",
    "endDate": "2017-11-10",
    "location": "Norfolk, VA",
    "tags": ["Web", "Cloud", "Mobile", "Community"],
    "coverImage": "/images/devfest.png"
  },
  {
    "name": "Hampton Roads DevFest 2016",
    "url": "https://hrdevfest.org/",
    "description": "A unique gathering spotlighting local speakers and showcasing our community's diverse talent. Organized by RevolutionVA, a 501(c)(3) non-profit dedicated to advancing software development education throughout Virginia. Ideal for developers, industry veterans, students, and tech enthusiasts looking to network, learn, and celebrate Hampton Roads' tech achievements.",
    "date": "2016-11-04",
    "endDate": "2016-11-04",
    "location": "Norfolk, VA",
    "tags": ["Web", "Cloud", "Mobile", "Community"],
    "coverImage": "/images/devfest.png"
  },
  {
    "name": "Tidal 2024",
    "url": "https://tidalconf.com/",
    "description": "A conference focused on design and technology in Hampton Roads",
    "date": "2024-11-09",
    "endDate": "2024-11-09",
    "location": "Norfolk, VA",
    "tags": ["Design", "UX", "Technology"],
    "coverImage": "/images/tidal.png"
  },
  {
    "name": "RevolutionConf 2019",
    "url": "https://revolutionconf.com/",
    "description": "A two-day, multi-track technology conference in Virginia Beach",
    "date": "2019-06-06",
    "endDate": "2019-06-07",
    "location": "Virginia Beach, VA",
    "tags": ["Web", "Mobile", "Cloud", "DevOps"],
    "coverImage": "/images/revolutionconf.png"
  },
  {
    "name": "RevolutionConf 2018",
    "url": "https://revolutionconf.com/",
    "description": "A two-day, multi-track technology conference in Virginia Beach",
    "date": "2018-05-17",
    "endDate": "2018-05-18",
    "location": "Virginia Beach, VA",
    "tags": ["Web", "Mobile", "Cloud", "DevOps"],
    "coverImage": "/images/revolutionconf.png"
  },
  {
    "name": "RevolutionConf 2017",
    "url": "https://revolutionconf.com/",
    "description": "A two-day, multi-track technology conference in Virginia Beach",
    "date": "2017-06-01",
    "endDate": "2017-06-02",
    "location": "Virginia Beach, VA",
    "tags": ["Web", "Mobile", "Cloud", "DevOps"],
    "coverImage": "/images/revolutionconf.png"
  },
  {
    "name": "RevolutionConf 2016",
    "url": "https://revolutionconf.com/",
    "description": "A one-day, multi-track technology conference in Virginia Beach",
    "date": "2016-05-13",
    "endDate": "2016-05-13",
    "location": "Virginia Beach, VA",
    "tags": ["Web", "Mobile", "Cloud", "DevOps"],
    "coverImage": "/images/revolutionconf.png"
  }
] 